Id,Headline,URL,Author,Date
1,"Framework’s computers aren’t perfect, but they are exciting",https://www.theverge.com/23664746/framework-laptop-excitement-vpr-matrix-history-nostalgia,Dan Seifert,1:00 PM UTC
2,Super73 launches Adventure Series and first e-bike for danger babies,https://www.theverge.com/2023/4/2/23662863/super73-adventure-e-bikes-k1d-kids-price-specs,Thomas Ricker,6:38 AM UTC
3,The Home Assistant SkyConnect is a great excuse to demolish your smart home and start from scratch,https://www.theverge.com/23641940/home-assistant-skyconnect-thread-matter-zigbee-smart-home,Chris Person,2:00 PM UTC
4,April Fools’ Day 2023: the best and cringiest pranks,https://www.theverge.com/2023/4/1/23665955/april-fools-day-2023-pranks-jokes-best-worst,Richard Lawler,12:10 AM UTC
5,How to change the region on an HP OfficeJet printer in 57 easy steps (printer companies hate this!),https://www.theverge.com/23648726/hp-officejet-printer-region-how-to-change-why,Nathan Edwards,Apr 1
6,"When healthcare is decided by algorithms, who wins?",https://www.theverge.com/23664533/medicare-advantage-healthcare-algorithm,Barbara Krasnoff,Apr 1